nombre,url,url_oai,tipo,divulgador
Ankulegi. Revista de Antropología Social,http://aldizkaria.ankulegi.org/index.php/ankulegi,http://aldizkaria.ankulegi.org/index.php/index/oai,Revista,"Ankulegi, Asociación Vasca de Antropología"
"Aibr, Revista de Antropología Iberoamericana",http://www.aibr.org/anthropology/net/indexco.php,http://www.aibr.org/anthropology/net/indexco.php/index/oai,Revista,Antropólogos Iberoamericanos en Red (AIBR)
"Barataria, Revista Castellano-Manchega de Ciencias Sociales",http://www.revistabarataria.es,http://revistabarataria.es/web/index.php/index/oai,Revista,Asociacion Castellano-Manchega de Sociologia (ACMS)
"Icono14, Revista científica de Comunicación y Tecnologías emergentes",http://www.icono14.net/ojs/index.php/icono14/,http://www.icono14.net/ojs/index.php/icono14/oai,Revista,Asociación Científica ICONO14
"Encrucijadas, Revista Crítica de Ciencias Sociales",http://www.encrucijadas.org/,http://www.encrucijadas.org/index.php/index/oai,Revista,Asociación Contubernio
"Sportis, Revista de Formación Deportiva",http://www.sportis.es/,http://www.sportis.es/revista/index.php/index/oai,Revista,Asociación Cultural Sportis Formación Deportiva
"Trama y Fondo, Revista de Cultura",http://www.tramayfondo.com,http://www.tramayfondo.com/oai,Revista,Asociación Cultural Trama y Fondo
Didáctica Geográfica,http://www.didacticageografica.com/didacticageografica,http://www.didacticageografica.com/didacticageografica/oai,Revista,Asociación de Geógrafos Españoles 
Journal of Sport and Health Research,http://www.journalshr.com,http://www.journalshr.com/index.php/index/oai,Revista,Asociación Didáctica de Andalucía
Investigaciones Regionales,http://www.investigacionesregionales.org/view/index.php,http://www.investigacionesregionales.org/view/index.php/index/oai,Revista,Asociación Española de Ciencia Regional (AECR)
"Motricidad, European Journal of Human Movement",http://www.eurjhm.com/index.php/eurjhm,http://www.eurjhm.com/index.php/index/oai,Revista,Asociación Española de Ciencias del Deporte
Investigaciones Sobre Lectura,http://comprensionlectora.es/revistaisl/index.php/revistaISL,http://comprensionlectora.es/revistaisl/index.php/index/oai,Revista,Asociación Española de Comprensión Lectora
Atlantis,http://www.atlantisjournal.org/index.php/atlantis,http://www.atlantisjournal.org/index.php/index/oai,Revista,Asociación española de estudios anglo-norteamericanos (AEDEAN )
"Rael, Revista Electrónica de Lingüística Aplicada, Asociacion Española de Lingüística Aplicada",http://dialnet.unirioja.es/servlet/revista?tipo_busqueda=CODIGO&clave_revista=6978,http://dialnet.unirioja.es/servlet/revista?tipo_busqueda=CODIGO&clave_revista=6978/oai,Revista,Asociación Española de Lingüística Aplicada
Revista de la Asociación Española de Neuropsiquiatría,http://ojs.www.revistaaen.es/index.php/aen,http://revistaaen.es/index.php/aen/oai,Revista,Asociación Española de Neuropsiquiatría
Revista Española de Orientación y Psicopedagogía,http://www.uned.es/reop,http://www2.uned.es/reop/index.php/index/oai,Revista,"Asociación Española de Orientación y Psicopedagogía (AEOP), Universidad Nacional de Educación a Distancia"
Revista Pediatría de Atención Primaria,http://www.pap.es/,http://www.pap.es/oai/request,Revista,Asociación Española de Pediatría de Atención Primaria
Ibérica,http://www.aelfe.org,http://www.aelfe.org/index.php/index/oai,Revista,Asociación Europea de Lenguas para Fines Específicos (AELFE)
Revista Profesional y Científica de Fisioterapia,http://revista.fisioterapiasinred.com/index.php?journal=fisioydivulgacion&page=index,http://revista.fisioterapiasinred.com/index.php?journal=fisioydivulgacion&page=index/oai,Revista,Asociación Fisioterapia Sin Red
"Panace@, Revista de Medicina, Lenguaje y Traducción, Tremédica: Asociación Internacional de Traductores y Redactores de Medicina y Ciencias Afines",http://medtrad.org/panacea.html,http://medtrad.org/panacea.html/oai,Revista,Asociación Internacional de Traductores y Redactores de Medicina y Ciencias Afines
"Tiempos Modernos, Revista Electrónica de Historia Moderna",http://www.tiemposmodernos.org/,http://www.tiemposmodernos.org/tm3/index.php/index/oai,Revista,Asociación Mundos Modernos
"Psicología, Sociedad y Educación",http://www.psye.org/en/index.php,http://www.psye.org/en/index.php/index/oai,Revista,Asociación para el Avance de la Psicología y la Educación (AAPE)
"IE Comunicaciones, Revista Iberoamericana de Informática Educativa",https://dialnet.unirioja.es/servlet/revista?codigo=12765,http://dialnet.unirioja.es/servlet/revista?codigo=12765/oai,Revista,Asociación para el Desarrollo de la Informática Educativa 
Historia Actual Online,http://www.historia-actual.org/Publicaciones/index.php/haol/index,http://www.historia-actual.org/Publicaciones/index.php/index/oai,Revista,Asociatión de Historia Actual
Biblioteca Digital de Aranjuez,biblioteca.aranjuez.es,http://biblioteca.aranjuez.es/i18n/oai/oai.cmd,Biblioteca,Ayuntamiento de Aranjuez
Biblioteca Virtual Silverio Lanza,bibliotecadigital.getafe.es,http://bibliotecadigital.getafe.es/bvgetafe/i18n/oai/oai_bibliotecadigital.getafe.es.cmd,Biblioteca,Ayuntamiento de Getafe
Biblioteca Digital memoriademadrid,http://www.memoriademadrid.es,http://repo.memoriademadrid.es:8080/repox/OAIHandler,Biblioteca,Ayuntamiento de Madrid
Scielo España,http://scielo.isciii.es/scielo.php,http://www.scielo.br/oai/scielo-oai.php,Biblioteca,Biblioteca Nacional de Ciencias de la Salud
"Publicaciones Didácticas, Revista Profesional de Investigación, Docencia y Recursos Didácticos",http://publicacionesdidacticas.com,http://publicacionesdidacticas.com/oai,Revista,Biblioteca Nacional de España
B-Salut,http://pub.bsalut.net/,http://pub.bsalut.net/cgi/oai2.cgi,Repositorio Institucional,B-Salut
Revista Andaluza de Medicina del Deporte,http://zl.elsevier.es/es/revista/revista-andaluza-medicina-del-deporte-284,http://www.elsevier.es/es-revista-revista-andaluza-medicina-del-deporte-284/oai,Revista,Centro Andaluz de Medicina del Deporte
"Revista Universitaria de Historia Militar On-line, Centro de Estudios de Historia Militar",http://ruhm.es/index.php/RUHM,http://ruhm.es/index.php/index/oai,Revista,Centro de Estudios de Historia Militar
"Andelma, Centro de Estudios Históricos Fray Pasqual Salmerón",http://tecnologiaycultura.net/andelma.html,http://tecnologiaycultura.net/andelma.html/oai,Revista,Centro de Estudios Históricos Fray Pasqual Salmerón
"Docu-menta, Repositorio Institucional del Ciemat",http://documenta.ciemat.es,http://documenta.ciemat.es/oai/request,Repositorio Institucional,"Centro de Investigaciones Energéticas, Medioambientales y Tecnológicas"
Revista Española de Discapacidad,http://www.cedd.net/redis,http://www.cedd.net/redis/index.php/index/oai,Revista,Centro Español de Documentación sobre Discapacidad (CEDD)
Boletín Epidemiológico Semanal,http://revistas.isciii.es/revistas.jsp?id=BES#_numeros,http://revista.isciii.es/index.php/bes/oai,Boletín,Centro Nacional de Epidemiología
Biblioteca Un Single en Madrid,http://www.singlesmadrid.es/,http://www.openarchives.es/singlemadrid/oai.asp,Biblioteca,Clan 2000
"Comparative Cinema, Revista de Investigación Estética de los Medios Audiovisuales",http://www.ocec.eu/cinemacomparativecinema/index.php/es/,http://www.ocec.eu/cinemacomparativecinema/index.php/index/oai,Revista,"Colectivo de Investigación Estética de los Medios Audiovisuales (CINEMA), Universidad Pompeu Fabra "
Métodos de Información,http://www.metodosdeinformacion.es,http://www.metodosdeinformacion.es/index.php/index/oai,Revista,Colegio Oficial de Biblotecarios-Documentalistas de la Comunidad Valenciana
Biblioteca Digital de la Comunidad de Madrid,http://www.bibliotecavirtualmadrid.org/bvmadrid_publicacion/es/estaticos/contenido.cmd?pagina=estaticos/presentacion,http://www.bibliotecavirtualmadrid.org/i18n/oai/oai.cmd,Biblioteca,Comunidad de Madrid
"emi+d, Repositorio Institucional de la Comunidad de Madrid",http://www.madrimasd.org/madrid-ciencia-tecnologia/e-ciencia/repositorio-emid,http://dpmadrono.cs.urjc.es:8080/oai/request,Repositorio Institucional,Comunidad de Madrid
Archivo Español de Arqueología,http://aespa.revistas.csic.es/index.php/aespa,http://aespa.revistas.csic.es/index.php/aespa,Colección,Consejo Superior de Investigaciones Científicas (CSIC)
Archivo Español de Arte,http://xn--archivoespaoldearte-53b.revistas.csic.es/index.php/aea,http://xn--archivoespaoldearte-53b.revistas.csic.es/index.php/aea,Colección,Consejo Superior de Investigaciones Científicas (CSIC)
Portal de Revistas Científicas del Consejo Superior de Investigaciones Científicas,http://revistas.csic.es,http://revistas.csic.es/index.php/index/oai,Portal de Revistas,Consejo Superior de Investigaciones Científicas (CSIC)
"Digital Csic, Repositorio Institucional del Consejo Superior de Investigaciones Científicas",http://www.csic.es/,https://digital.csic.es/dspace-oai/request,Repositorio Institucional,Consejo Superior de Investigaciones Científicas (CSIC)
Anales del Jardín Botánico de Madrid,http://rjb.revistas.csic.es/index.php/rjb,http://rjb.revistas.csic.es/index.php/rjb/oai,Revista,Consejo Superior de Investigaciones Científicas (CSIC)
Collectanea Botanica,http://collectaneabotanica.revistas.csic.es/index.php/collectaneabotanica,http://collectaneabotanica.revistas.csic.es/index.php/collectaneabotanica/oai,Revista,Consejo Superior de Investigaciones Científicas (CSIC)
Estudios Geológicos,http://estudiosgeol.revistas.csic.es/index.php/estudiosgeol,http://estudiosgeol.revistas.csic.es/index.php/estudiosgeol/oai,Revista,Consejo Superior de Investigaciones Científicas (CSIC)
Graellsia,http://graellsia.revistas.csic.es/index.php/graellsia,http://graellsia.revistas.csic.es/index.php/graellsia/oai,Revista,Consejo Superior de Investigaciones Científicas (CSIC)
Grasas y Aceites,http://grasasyaceites.revistas.csic.es/index.php/grasasyaceites,http://grasasyaceites.revistas.csic.es/index.php/grasasyaceites/oai,Revista,Consejo Superior de Investigaciones Científicas (CSIC)
Informes de la Construcción,http://informesdelaconstruccion.revistas.csic.es/index.php/informesdelaconstruccion,http://informesdelaconstruccion.revistas.csic.es/index.php/informesdelaconstruccion/oai,Revista,Consejo Superior de Investigaciones Científicas (CSIC)
Materiales de Construcción,http://materconstrucc.revistas.csic.es/index.php/materconstrucc,http://materconstrucc.revistas.csic.es/index.php/materconstrucc/oai,Revista,Consejo Superior de Investigaciones Científicas (CSIC)
"Pirineos, Revista de Ecología de Montaña",http://pirineos.revistas.csic.es,http://pirineos.revistas.csic.es/index.php/index/oai,Revista,Consejo Superior de Investigaciones Científicas (CSIC)
Revista de Metalurgia,http://revistademetalurgia.revistas.csic.es/index.php/revistademetalurgia,http://revistademetalurgia.revistas.csic.es/index.php/revistademetalurgia/oai,Revista,Consejo Superior de Investigaciones Científicas (CSIC)
Scientia Marina,http://scientiamarina.revistas.csic.es/index.php/scientiamarina,http://scientiamarina.revistas.csic.es/index.php/scientiamarina/oai,Revista,Consejo Superior de Investigaciones Científicas (CSIC)
"Al-Qanṭara, civilización del Islam Clásico",http://al-qantara.revistas.csic.es/index.php/al-qantara,http://al-qantara.revistas.csic.es/index.php/al-qantara,Revista,Consejo Superior de Investigaciones Científicas (CSIC)
"Anales Cervantinos, Investigación sobre el Quijote",http://analescervantinos.revistas.csic.es/index.php/analescervantinos,http://analescervantinos.revistas.csic.es/index.php/analescervantinos,Revista,Consejo Superior de Investigaciones Científicas (CSIC)
Anuario de Estudios Americanos,http://estudiosamericanos.revistas.csic.es/index.php/estudiosamericanos,http://estudiosamericanos.revistas.csic.es/index.php/estudiosamericanos,Revista,Consejo Superior de Investigaciones Científicas (CSIC)
Anuario de Estudios Medievales,http://estudiosmedievales.revistas.csic.es/index.php/estudiosmedievales,http://estudiosmedievales.revistas.csic.es/index.php/estudiosmedievales,Revista,Consejo Superior de Investigaciones Científicas (CSIC)
Anuario Musical,http://anuariomusical.revistas.csic.es/index.php/anuariomusical,http://anuariomusical.revistas.csic.es/index.php/anuariomusical,Revista,Consejo Superior de Investigaciones Científicas (CSIC)
Arqueología de la Arquitectura,http://arqarqt.revistas.csic.es/index.php/arqarqt,http://arqarqt.revistas.csic.es/index.php/arqarqt,Revista,Consejo Superior de Investigaciones Científicas (CSIC)
Asclepio. Revista de Historia de la Medicina y de la Ciencia,http://asclepio.revistas.csic.es/index.php/asclepio,http://asclepio.revistas.csic.es/index.php/asclepio,Revista,Consejo Superior de Investigaciones Científicas (CSIC)
Cuadernos de Estudios Gallegos,http://estudiosgallegos.revistas.csic.es/index.php/estudiosgallegos,http://estudiosgallegos.revistas.csic.es/index.php/estudiosgallegos,Revista,Consejo Superior de Investigaciones Científicas (CSIC)
Culture & History Digital Journal,http://cultureandhistory.revistas.csic.es/index.php/cultureandhistory,http://cultureandhistory.revistas.csic.es/index.php/cultureandhistory,Revista,Consejo Superior de Investigaciones Científicas (CSIC)
"Emerita, Filología clásica, Lingüística griega, latina, indoeuropea e ibérica, e Historia antigua",http://emerita.revistas.csic.es/index.php/emerita,http://emerita.revistas.csic.es/index.php/emerita,Revista,Consejo Superior de Investigaciones Científicas (CSIC)
Estudios Geográficos,http://estudiosgeograficos.revistas.csic.es/index.php/estudiosgeograficos,http://estudiosgeograficos.revistas.csic.es/index.php/estudiosgeograficos,Revista,Consejo Superior de Investigaciones Científicas (CSIC)
"Gladius, Armamento desde la Prehistoria hasta fines del siglo XVIII, Polemología, Historia de la guerra en Europa, el mundo colonial americano, y el Islam",http://gladius.revistas.csic.es/index.php/gladius,http://gladius.revistas.csic.es/index.php/gladius,Revista,Consejo Superior de Investigaciones Científicas (CSIC)
Hispania. Revista Española de Historia,http://hispania.revistas.csic.es/index.php/hispania,http://hispania.revistas.csic.es/index.php/hispania,Revista,Consejo Superior de Investigaciones Científicas (CSIC)
"Hispania Sacra, Historia Religiosa ",http://hispaniasacra.revistas.csic.es/index.php/hispaniasacra,http://hispaniasacra.revistas.csic.es/index.php/hispaniasacra,Revista,Consejo Superior de Investigaciones Científicas (CSIC)
"Loquens, Analyzing Speech",http://loquens.revistas.csic.es/index.php/loquens,http://loquens.revistas.csic.es/index.php/loquens,Revista,Consejo Superior de Investigaciones Científicas (CSIC)
Revista de Dialectología y Tradiciones Populares,http://rdtp.revistas.csic.es/index.php/rdtp,http://rdtp.revistas.csic.es/index.php/rdtp,Revista,Consejo Superior de Investigaciones Científicas (CSIC)
Revista de Filología Española,http://xn--revistadefilologiaespaola-uoc.revistas.csic.es/index.php/rfe,http://xn--revistadefilologiaespaola-uoc.revistas.csic.es/index.php/rfe,Revista,Consejo Superior de Investigaciones Científicas (CSIC)
"Revista de Indias, Historia de América",http://revistadeindias.revistas.csic.es/index.php/revistadeindias,http://revistadeindias.revistas.csic.es/index.php/revistadeindias,Revista,Consejo Superior de Investigaciones Científicas (CSIC)
Revista de literatura,http://revistadeliteratura.revistas.csic.es/index.php/revistadeliteratura,http://revistadeliteratura.revistas.csic.es/index.php/revistadeliteratura,Revista,Consejo Superior de Investigaciones Científicas (CSIC)
"Sefarad, Estudios Hebraicos",http://sefarad.revistas.csic.es/index.php/sefarad,http://sefarad.revistas.csic.es/index.php/sefarad,Revista,Consejo Superior de Investigaciones Científicas (CSIC)
"Trabajos de Prehistoria, trabajos de teoría y metodología arqueológica ",http://tp.revistas.csic.es/index.php/tp,http://tp.revistas.csic.es/index.php/tp,Revista,Consejo Superior de Investigaciones Científicas (CSIC)
"Arbor, ciencia, pensamiento y cultura",http://arbor.revistas.csic.es/index.php/arbor,http://arbor.revistas.csic.es/index.php/arbor,Revista,Consejo Superior de Investigaciones Científicas (CSIC)
"Isegoría, Filosofía moral y política",http://isegoria.revistas.csic.es/index.php/isegoria,http://isegoria.revistas.csic.es/index.php/isegoria,Revista,Consejo Superior de Investigaciones Científicas (CSIC)
Revista española de Documentación Científica,http://redc.revistas.csic.es/index.php/redc,http://redc.revistas.csic.es/index.php/redc,Revista,Consejo Superior de Investigaciones Científicas (CSIC)
Revista Internacional de Sociología,http://revintsociologia.revistas.csic.es/index.php/revintsociologia,http://revintsociologia.revistas.csic.es/index.php/revintsociologia,Revista,Consejo Superior de Investigaciones Científicas (CSIC)
"Tdx, Tesis doctorales en Red ",http://tdx.cat/,http://tdx.cat/oai/request,Colección,Consorci de Serveis Universitaris de Catalunya (CSUC)
"Raco, Portal de Revistas Científicas de Cataluña",http://www.raco.cat/index.php/raco,http://www.raco.cat/index.php/index/oai,Portal de Revistas,Consorci de Serveis Universitaris de Catalunya (CSUC)
"Tdr, Tesis Doctorales en Red",http://www.tesisenred.net,http://www.tesisenred.net/oai/request,Colección,Consorci de Serveis Universitaris de Catalunya (CSUC)
Fondo Documental Histórico de las Cortes de Aragón,http://www.cortesaragon.es/fondoHistorico/i18n/inicio/inicio.cmd,http://www.cortesaragon.es/fondoHistorico/i18n/oai/oai_fondohistorico.cortesaragon.es.cmd,Colección,Cortes de Aragón
Journal of Science and Cycling,http://www.jsc-journal.com/ojs/index.php?journal=JSC,http://www.jsc-journal.com/ojs/index.php/index/oai,Revista,Cycling Research Center
Biblioteca Virtual de la Diputación de Zaragoza,www.bivizar.es,http://www.bivizar.es/i18n/oai/oai.cmd,Biblioteca,Diputación de Zaragoza
Tebeosfera,http://www.tebeosfera.com,http://www.tebeosfera.com/portada.php/index/oai,Revista,Ediciones ACT
Agon International Journal of Sport Sciences,http://www.agonjournal.com,http://agonjournal.com/index/oai/,Revista,Ediciones Agon
"rita_, redfundamentos SL",http://ojs.redfundamentos.com/,http://ojs.redfundamentos.com/index.php/index/oai,Revista,Ediciones Redfundamentos
"3C Tic, Revista Científica de la Información y comunicacnión",http://ojs.3ciencias.com/index.php/3c-tic,http://ojs.3ciencias.com/index.php/index/oai,Revista,Editorial 3Ciencias
"3C Tecnología, Revista Científica de Innovación Tecnológica y la Ingeniería ",http://ojs.3ciencias.com/index.php/3c-tecnologia,http://ojs.3ciencias.com/index.php/index/oai,Revista,Editorial 3Ciencias
"3C Empresa, Revista Científica de la Economía y las Ciencias Sociales",http://ojs.3ciencias.com/index.php/3c-empresa,http://ojs.3ciencias.com/index.php/index/oai,Revista,Editorial 3Ciencias
"Caracteres, Estudios Culturales y Críticos de la Esfera Digital",http://revistacaracteres.net,http://www.erevistas.csic.es/dp/oai1601/,Revista,Editorial Delirio
"Foro de Educación, FahrenHouse",http://www.forodeeducacion.com/,http://forodeeducacion.com/ojs/index.php/index/oai,Revista,Editorial FahrenHouse
"Hipatia Press, Portal de Revistas Científicas de la Editorial Hipatia",http://www.hipatiapress.info/hpjournals,http://www.hipatiapress.info/hpjournals/index.php/index/oai,Portal de Revistas,Editorial Hipatia
"Remie, Multidisciplinary Journal of Educational Research, Hipatia Press",http://remie.hipatiapress.com,http://hipatiapress.com/hpjournals/index.php/index/oai,Revista,Editorial Hipatia
"International Journal of Educational Psychology, Hipatia Press",http://ijep.hipatiapress.com ,http://hipatiapress.com/hpjournals/index.php/index/oai,Revista,Editorial Hipatia
"Géneros, Multidisciplinary Journal of Gender Studies, Hipatia Press",http://hipatiapress.com/hpjournals/index.php/generos/index,http://hipatiapress.com/hpjournals/index.php/index/oai,Revista,Editorial Hipatia
"International Journal of Deliberative Mechanisms in Science, Hipatia Press",http://demesci.hipatiapress.com,http://hipatiapress.com/hpjournals/index.php/index/oai,Revista,Editorial Hipatia
"Qualitative Research in Education, Hipatia Press",http://qre.hipatiapress.com,http://hipatiapress.com/hpjournals/index.php/index/oai,Revista,Editorial Hipatia
"Research on Ageing and Social Policy, Hipatia Press",http://rasp.hipatiapress.info/,http://hipatiapress.com/hpjournals/index.php/index/oai,Revista,Editorial Hipatia
"Brac, Barcelona Investigación Arte Creación",http://hipatiapress.com/hpjournals/index.php/brac,http://hipatiapress.com/hpjournals/index.php/brac/oai,Revista,Editorial Hipatia
Communication & Social Change,http://hipatiapress.com/hpjournals/index.php/csc,http://hipatiapress.com/hpjournals/index.php/csc/oai,Revista,Editorial Hipatia
"Géneros, Multidisciplinary Journal of Gender Studies",http://hipatiapress.com/hpjournals/index.php/generos,http://hipatiapress.com/hpjournals/index.php/generos/oai,Revista,Editorial Hipatia
"Hse, Historia Social y de la Educación",http://hipatiapress.com/hpjournals/index.php/hse,http://hipatiapress.com/hpjournals/index.php/hse/oai,Revista,Editorial Hipatia
"Ijelm, International Journal of Educational Leadership and Management",http://hipatiapress.com/hpjournals/index.php/ijelm,http://hipatiapress.com/hpjournals/index.php/ijelm/oai,Revista,Editorial Hipatia
"Ijep, International Journal of Educational Psychology",http://hipatiapress.com/hpjournals/index.php/ijep,http://hipatiapress.com/hpjournals/index.php/ijep/oai,Revista,Editorial Hipatia
"Msc, Masculinidades y Cambio Social",http://hipatiapress.com/hpjournals/index.php/mcs,http://hipatiapress.com/hpjournals/index.php/mcs/oai,Revista,Editorial Hipatia
"Qre, Qualitative Research in Education",http://hipatiapress.com/hpjournals/index.php/qre,http://hipatiapress.com/hpjournals/index.php/qre/oai,Revista,Editorial Hipatia
"Rasp, Research on Ageing and Social Policy",http://hipatiapress.com/hpjournals/index.php/rasp,http://hipatiapress.com/hpjournals/index.php/rasp/oai,Revista,Editorial Hipatia
"Redimat, Journal of Research in Mathematics Education",http://www.hipatiapress.info/hpjournals/index.php/redimat,http://www.hipatiapress.info/hpjournals/index.php/redimat/oai,Revista,Editorial Hipatia
"Remie, Multidisciplinary Journal of Educational Research",http://hipatiapress.com/hpjournals/index.php/remie,http://hipatiapress.com/hpjournals/index.php/remie/oai,Revista,Editorial Hipatia
"Rimcis, International and Multidisciplinary Journal of Social Sciences",http://hipatiapress.com/hpjournals/index.php/rimcis,http://hipatiapress.com/hpjournals/index.php/rimcis/oai,Revista,Editorial Hipatia
"Rise, International Journal of Sociology of Education",http://hipatiapress.com/hpjournals/index.php/rise,http://hipatiapress.com/hpjournals/index.php/rise/oai,Revista,Editorial Hipatia
Test Article,http://www.hipatiapress.info/hpjournals/index.php/test,http://www.hipatiapress.info/hpjournals/index.php/test/oai,Revista,Editorial Hipatia
"Ijrs, International Journal of Romani Studies",http://www.hipatiapress.info/hpjournals/index.php/ijrs,http://www.hipatiapress.info/hpjournals/index.php/ijrs/oai,Revista,Editorial Hipatia
Social Impact of Research,http://www.hipatiapress.info/hpjournals/index.php/sir,http://www.hipatiapress.info/hpjournals/index.php/sir/oai,Revista,Editorial Hipatia
"Demesci, International Journal of Deliberative Mechanisms in Science",http://www.hipatiapress.info/hpjournals/index.php/demesci,http://www.hipatiapress.info/hpjournals/index.php/demesci/oai,Revista,Editorial Hipatia
Revista catalana de dret públic,http://revistes.eapc.gencat.cat/index.php/rcdp,http://revistes.eapc.gencat.cat/index.php/rcdp/oai,Revista,Escuela de Administración Pública de Cataluña (EAPC)
Revista de Llengua i Dret,http://revistes.eapc.gencat.cat/index.php/rld,http://revistes.eapc.gencat.cat/index.php/rld/oai,Revista,Escuela de Administración Pública de Cataluña (EAPC)
"Savia, Repositorio Institucional de la Escuela de Organización Industrial ",http://www.eoi.es/savia,http://repositorio1.eoi.es:54002/escidoc-oaiprovider/,Repositorio Institucional,Escuela de Organización Industrial 
Medicina y Seguridad del Trabajo,http://revistas.isciii.es/revistas.jsp?id=MST#_numeros,http://revista.isciii.es/index.php/mst/oai ,Revista,Escuela Nacional de Medicina del Trabajo (ENMT)
"Revista de Docencia e Investigación,",http://www.uclm.es/varios/revistas/docenciaeinvestigacion/,http://www.uclm.es/profesorado/ricardo/Docencia_e_Investigacion/Docencia_e_Investigacion.htm/oai,Revista,"E.U. Magisterio de Toledo, Universidad de Castilla-La Mancha"
"El Futuro del Pasado, Revista Electrónica de Historia",http://www.elfuturodelpasado.com/elfuturodelpasado/Home.html,http://www.elfuturodelpasado.com/ojs/index.php/index/oai,Revista,Fahren House
"Espacio, Tiempo y Educación, FahrenHouse",http://www.espaciotiempoyeducacion.com,http://www.espaciotiempoyeducacion.com/ojs/index.php/index/oai,Revista,Fahren House
"E-balonmano.com, Revista de Ciencias del Deporte",http://www.e-balonmano.com/ojs/index.php/revista/index,http://www.e-balonmano.com/ojs/index.php/index/oai,Revista,Federación Extremeña de Balonmano
Revista Iberoamericana de Psicología y Salud,http://suips.webs.uvigo.es,http://suips.webs.uvigo.es/index.php/index/oai,Revista,"Federación Internacional de Asociaciones de Psicología (FIAP), Universidad de Vigo"
"Nure Investigación, Foundation for Nursery Development",http://www.nureinvestigacion.es/OJS/index.php/nure/,http://www.nureinvestigacion.es/OJS/index.php/index/oai,Revista,"Foundation for Nursery Development, (FUDEN)"
Revista Española de Nutrición Humana y Dietética,http://renhyd.org/,http://renhyd.org/index.php/index/oai,Revista,Fundación Española de Dietistas-Nutricionistas (FEDN)
